{"$schema":"https://json-schema.org/draft/2020-12/schema","$id":"https://umn.example/schemas/straglr-normalized-evidence.schema.json","schema_version":"1.0","type":"object","required":["record_schema_version","evidence_state","records","normalization_warnings"],"properties":{"record_schema_version":{"const":"1.0"},"evidence_state":{"enum":["AVAILABLE","NOT_APPLICABLE","INPUT_MISSING","COMPUTATION_FAILED","AMBIGUOUS","NOT_COMPUTED","UNSUPPORTED_FORMAT"]},"records":{"type":"array","items":{"$ref":"normalized-caller-evidence.schema.json"}},"normalization_warnings":{"type":"array","items":{"type":"string"}}},"additionalProperties":false}
