{
  "evidence_state": "AVAILABLE",
  "normalization_warnings": [
    "Synthetic fixture generated with the development-only provisional adapter."
  ],
  "record_schema_version": "1.0",
  "records": [
    {
      "analysis_source": "RAW_READS",
      "assignment_state": "UNASSIGNED",
      "associated_sequence_id": null,
      "caller": "STRAGLR",
      "caller_version": "1.5.0",
      "case_id": "SYNTH_CASE",
      "chromosome": "chrSynthetic",
      "coordinate_convention": "zero_based_half_open",
      "end": 112,
      "locus_id": "SYNTH_LOCUS",
      "native_allele_identifier": "allele-1",
      "native_record_identifier": "synthetic-record-1",
      "normalization_warnings": [],
      "quality_state": "AVAILABLE",
      "raw_fields": {
        "allele_id": "allele-1",
        "caller_specific": "0007",
        "chromosome": "chrSynthetic",
        "end": "112",
        "locus_id": "SYNTH_LOCUS",
        "record_id": "synthetic-record-1",
        "repeat_count": "004",
        "repeat_size": "12",
        "repeat_unit": "CAG",
        "start": "100",
        "supporting_reads": "3",
        "total_spanning_reads": "8"
      },
      "record_id": "straglr-synthetic-record-1-allele-1",
      "record_schema_version": "1.0",
      "reference_build": "GRCh38",
      "reported_motif": "CAG",
      "reported_motif_chain": null,
      "reported_repeat_count": "004",
      "reported_repeat_length_bp": "12",
      "sample_id": "SYNTH_SAMPLE",
      "source_file_id": "straglr-native-1",
      "source_file_sha256": "02dff5f6363251489c3f4f607619e280a0277a3c59faed11c144921dac3f1823",
      "start": 100,
      "subject_id": "SYNTH_SUBJECT",
      "supporting_reads": 3,
      "total_spanning_reads": 8
    },
    {
      "analysis_source": "RAW_READS",
      "assignment_state": "UNASSIGNED",
      "associated_sequence_id": null,
      "caller": "STRAGLR",
      "caller_version": "1.5.0",
      "case_id": "SYNTH_CASE",
      "chromosome": "chrSynthetic",
      "coordinate_convention": "zero_based_half_open",
      "end": 118,
      "locus_id": "SYNTH_LOCUS",
      "native_allele_identifier": "allele-2",
      "native_record_identifier": "synthetic-record-2",
      "normalization_warnings": [],
      "quality_state": "AVAILABLE",
      "raw_fields": {
        "allele_id": "allele-2",
        "caller_specific": "alpha",
        "chromosome": "chrSynthetic",
        "end": "118",
        "locus_id": "SYNTH_LOCUS",
        "record_id": "synthetic-record-2",
        "repeat_count": "6",
        "repeat_size": "18",
        "repeat_unit": "CAG",
        "start": "100",
        "supporting_reads": "5",
        "total_spanning_reads": "8"
      },
      "record_id": "straglr-synthetic-record-2-allele-2",
      "record_schema_version": "1.0",
      "reference_build": "GRCh38",
      "reported_motif": "CAG",
      "reported_motif_chain": null,
      "reported_repeat_count": "6",
      "reported_repeat_length_bp": "18",
      "sample_id": "SYNTH_SAMPLE",
      "source_file_id": "straglr-native-1",
      "source_file_sha256": "02dff5f6363251489c3f4f607619e280a0277a3c59faed11c144921dac3f1823",
      "start": 100,
      "subject_id": "SYNTH_SUBJECT",
      "supporting_reads": 5,
      "total_spanning_reads": 8
    }
  ]
}
